,,,,,,,,,,,277,13185760, on i scold our , on ,2774243, i ,9937877, scold ,217, our ,473423, 276,12784150, on i scold hour , on ,2774243, i ,9937877, scold ,217, hour ,71813, 127,11205686, an i scold our , an ,794169, i ,9937877, scold ,217, our ,473423, 126,10804076, an i scold hour , an ,794169, i ,9937877, scold ,217, hour ,71813, 49,8253272, a nice cold our , a ,7536297, nice ,190708, cold ,52844, our ,473423, 63,8011331, a nigh scold our , a ,7536297, nigh ,1394, scold ,217, our ,473423, 67,8009974, a nye scold our , a ,7536297, nye ,37, scold ,217, our ,473423, 48,7851662, a nice cold hour , a ,7536297, nice ,190708, cold ,52844, hour ,71813, 46,7747572, a nice coal dour , a ,7536297, nice ,190708, coal ,20448, dour ,119, 47,7747545, a nice coal dower , a ,7536297, nice ,190708, coal ,20448, dower ,92, 50,7729197, a nice cole dour , a ,7536297, nice ,190708, cole ,2073, dour ,119, 51,7729170, a nice cole dower , a ,7536297, nice ,190708, cole ,2073, dower ,92, 52,7728036, a nice kohl dour , a ,7536297, nice ,190708, kohl ,912, dour ,119, 53,7728009, a nice kohl dower , a ,7536297, nice ,190708, kohl ,912, dower ,92, 62,7609721, a nigh scold hour , a ,7536297, nigh ,1394, scold ,217, hour ,71813, 66,7608364, a nye scold hour , a ,7536297, nye ,37, scold ,217, hour ,71813, 265,3378386, on aye scold our , on ,2774243, aye ,130503, scold ,217, our ,473423, 283,3312712, on ice cold our , on ,2774243, ice ,12202, cold ,52844, our ,473423, 273,3274633, on eye scold our , on ,2774243, eye ,26750, scold ,217, our ,473423, 264,2976776, on aye scold hour , on ,2774243, aye ,130503, scold ,217, hour ,71813, 282,2911102, on ice cold hour , on ,2774243, ice ,12202, cold ,52844, hour ,71813, 272,2873023, on eye scold hour , on ,2774243, eye ,26750, scold ,217, hour ,71813, 280,2807012, on ice coal dour , on ,2774243, ice ,12202, coal ,20448, dour ,119, 281,2806985, on ice coal dower , on ,2774243, ice ,12202, coal ,20448, dower ,92, 284,2788637, on ice cole dour , on ,2774243, ice ,12202, cole ,2073, dour ,119, 285,2788610, on ice cole dower , on ,2774243, ice ,12202, cole ,2073, dower ,92, 286,2787476, on ice kohl dour , on ,2774243, ice ,12202, kohl ,912, dour ,119, 287,2787449, on ice kohl dower , on ,2774243, ice ,12202, kohl ,912, dower ,92, 115,1398312, an aye scold our , an ,794169, aye ,130503, scold ,217, our ,473423, 133,1332638, an ice cold our , an ,794169, ice ,12202, cold ,52844, our ,473423, 123,1294559, an eye scold our , an ,794169, eye ,26750, scold ,217, our ,473423, 114,996702, an aye scold hour , an ,794169, aye ,130503, scold ,217, hour ,71813, 89,946271, ah nice cold our , ah ,229296, nice ,190708, cold ,52844, our ,473423, 132,931028, an ice cold hour , an ,794169, ice ,12202, cold ,52844, hour ,71813, 122,892949, an eye scold hour , an ,794169, eye ,26750, scold ,217, hour ,71813, 130,826938, an ice coal dour , an ,794169, ice ,12202, coal ,20448, dour ,119, 131,826911, an ice coal dower , an ,794169, ice ,12202, coal ,20448, dower ,92, 134,808563, an ice cole dour , an ,794169, ice ,12202, cole ,2073, dour ,119, 135,808536, an ice cole dower , an ,794169, ice ,12202, cole ,2073, dower ,92, 136,807402, an ice kohl dour , an ,794169, ice ,12202, kohl ,912, dour ,119, 137,807375, an ice kohl dower , an ,794169, ice ,12202, kohl ,912, dower ,92, 159,783938, eh nice cold our , eh ,66963, nice ,190708, cold ,52844, our ,473423, 103,704330, ah nigh scold our , ah ,229296, nigh ,1394, scold ,217, our ,473423, 107,702973, ah nye scold our , ah ,229296, nye ,37, scold ,217, our ,473423, 88,544661, ah nice cold hour , ah ,229296, nice ,190708, cold ,52844, hour ,71813, 173,541997, eh nigh scold our , eh ,66963, nigh ,1394, scold ,217, our ,473423, 177,540640, eh nye scold our , eh ,66963, nye ,37, scold ,217, our ,473423, 86,440571, ah nice coal dour , ah ,229296, nice ,190708, coal ,20448, dour ,119, 87,440544, ah nice coal dower , ah ,229296, nice ,190708, coal ,20448, dower ,92, 90,422196, ah nice cole dour , ah ,229296, nice ,190708, cole ,2073, dour ,119, 91,422169, ah nice cole dower , ah ,229296, nice ,190708, cole ,2073, dower ,92, 92,421035, ah nice kohl dour , ah ,229296, nice ,190708, kohl ,912, dour ,119, 93,421008, ah nice kohl dower , ah ,229296, nice ,190708, kohl ,912, dower ,92, 158,382328, eh nice cold hour , eh ,66963, nice ,190708, cold ,52844, hour ,71813, 102,302720, ah nigh scold hour , ah ,229296, nigh ,1394, scold ,217, hour ,71813, 106,301363, ah nye scold hour , ah ,229296, nye ,37, scold ,217, hour ,71813, 156,278238, eh nice coal dour , eh ,66963, nice ,190708, coal ,20448, dour ,119, 157,278211, eh nice coal dower , eh ,66963, nice ,190708, coal ,20448, dower ,92, 160,259863, eh nice cole dour , eh ,66963, nice ,190708, cole ,2073, dour ,119, 161,259836, eh nice cole dower , eh ,66963, nice ,190708, cole ,2073, dower ,92, 162,258702, eh nice kohl dour , eh ,66963, nice ,190708, kohl ,912, dour ,119, 163,258675, eh nice kohl dower , eh ,66963, nice ,190708, kohl ,912, dower ,92, 172,140387, eh nigh scold hour , eh ,66963, nigh ,1394, scold ,217, hour ,71813, 176,139030, eh nye scold hour , eh ,66963, nye ,37, scold ,217, hour ,71813, NO TESTS FAILED! :) ,,,,,,,,,,,